{
  "repository": "your-username/your-repo",
  "ticketsPath": "kabane",
  "defaultBranch": "main",
  "columns": [
    {
      "id": "backlog",
      "name": "Backlog",
      "statuses": ["backlog"],
      "color": "#8b949e"
    },
    {
      "id": "todo",
      "name": "To Do",
      "statuses": ["todo", "ready"],
      "color": "#58a6ff"
    },
    {
      "id": "in-progress",
      "name": "In Progress",
      "statuses": ["in-progress", "doing"],
      "color": "#d29922"
    },
    {
      "id": "review",
      "name": "Review",
      "statuses": ["review", "testing"],
      "color": "#a371f7"
    },
    {
      "id": "done",
      "name": "Done",
      "statuses": ["done", "closed", "completed"],
      "color": "#3fb950"
    }
  ],
  "ticketTypes": [
    {
      "id": "epic",
      "name": "Epic",
      "icon": "‚ö°",
      "color": "#a371f7"
    },
    {
      "id": "story",
      "name": "User Story",
      "icon": "üìñ",
      "color": "#3fb950"
    },
    {
      "id": "bug",
      "name": "Bug",
      "icon": "üêõ",
      "color": "#f85149"
    },
    {
      "id": "task",
      "name": "Task",
      "icon": "‚úÖ",
      "color": "#58a6ff"
    }
  ]
}
